{
  "$schema": "https://json-schema.org/draft/2020-12/schema",
  "$id": "https://cosmic-vikings/ar-agent/contracts/revenue-data.schema.json",
  "title": "RevenueData",
  "description": "Recognized AR revenue (invoice presentment + Foodics POS sales) for a period. Produced by ar_reporting / ar_reconcile.",
  "x-contract-version": "1.0.0",
  "x-status": "draft",
  "x-since": "2026-07-06",
  "type": "object",
  "additionalProperties": false,
  "required": ["trace_id", "tenant", "period", "total", "currency", "by_segment", "contract_version"],
  "properties": {
    "trace_id": {"type": "string", "minLength": 1},
    "tenant": {"type": "string", "minLength": 1},
    "period": {"$ref": "#/$defs/period"},
    "total": {"type": "string", "pattern": "^\\d+\\.\\d{2}$", "description": "Total recognized revenue, non-negative 2dp string."},
    "currency": {"type": "string", "pattern": "^[A-Z]{3}$"},
    "by_segment": {
      "type": "array",
      "minItems": 1,
      "items": {"$ref": "#/$defs/segment"}
    },
    "by_invoice": {
      "type": "array",
      "items": {"$ref": "#/$defs/invoice_breakdown"}
    },
    "by_customer_ref": {
      "type": "array",
      "items": {"$ref": "#/$defs/customer_breakdown"}
    },
    "comparison_prior_period": {"$ref": "#/$defs/comparison"},
    "generated_at": {"type": "string", "pattern": "^\\d{4}-\\d{2}-\\d{2}T\\d{2}:\\d{2}:\\d{2}Z$"},
    "contract_version": {"type": "string", "pattern": "^\\d+\\.\\d+\\.\\d+$"}
  },
  "$defs": {
    "period": {
      "type": "object",
      "additionalProperties": false,
      "required": ["start", "end"],
      "properties": {
        "start": {"type": "string", "pattern": "^\\d{4}-\\d{2}-\\d{2}$"},
        "end": {"type": "string", "pattern": "^\\d{4}-\\d{2}-\\d{2}$"}
      }
    },
    "segment": {
      "type": "object",
      "additionalProperties": false,
      "required": ["segment", "amount", "count"],
      "properties": {
        "segment": {"type": "string", "minLength": 1, "description": "e.g. dine_in, delivery, catering, branch-<id>."},
        "amount": {"type": "string", "pattern": "^\\d+\\.\\d{2}$"},
        "count": {"type": "integer", "minimum": 0}
      }
    },
    "invoice_breakdown": {
      "type": "object",
      "additionalProperties": false,
      "required": ["invoice_ref", "amount"],
      "properties": {
        "invoice_ref": {"type": "string", "minLength": 1},
        "customer_ref": {"type": "string", "minLength": 1},
        "amount": {"type": "string", "pattern": "^\\d+\\.\\d{2}$"}
      }
    },
    "customer_breakdown": {
      "type": "object",
      "additionalProperties": false,
      "required": ["customer_ref", "amount", "count"],
      "properties": {
        "customer_ref": {"type": "string", "minLength": 1, "description": "Customer id; no PII (§16)."},
        "amount": {"type": "string", "pattern": "^\\d+\\.\\d{2}$"},
        "count": {"type": "integer", "minimum": 0}
      }
    },
    "comparison": {
      "type": "object",
      "additionalProperties": false,
      "required": ["prior_total", "delta"],
      "properties": {
        "prior_total": {"type": "string", "pattern": "^\\d+\\.\\d{2}$"},
        "delta": {"type": "string", "pattern": "^-?\\d+\\.\\d{2}$", "description": "current - prior, signed 2dp string."}
      }
    }
  }
}